### ISSUE TITLE
Directory server returns oversized datagram, causing server list to not appear through VPN

### ISSUE THREAD

**Issue by dtinth** [jamulussoftware/jamulus#1957]
**Describe the bug**
I have a problem where I cannot see the servers my friend is in on the server list. I found that once I obtained the IP of that server, I can connect to it but I need to use a VPN.

However, when VPN is enabled, the **Connect** dialog shows an empty list.

**Technical findings**
The _Any Genre 1_ directory server seems to reply with an oversized datagram which the VPN server blocks. Here’s how I reached this conclusion: I ran this command to capture the communication between my machine and the directory server:

```sh
$ sudo tcpdump host anygenre1.jamulus.io and udp
```

The results show “UDP, bad length”.

```
20:55:43.804706 IP 192.168.0.186.22141 > 62.113.206.102.22124: UDP, length 9
20:55:44.018752 IP 62.113.206.102.22124 > 192.168.0.186.22141: UDP, bad length 2724 > 1360
20:55:44.018756 IP 62.113.206.102 > 192.168.0.186: udp
20:55:44.027122 IP 62.113.206.102.22124 > 192.168.0.186.22141: UDP, bad length 5108 > 1272
```

My router and my ISP handles this oversized datagram just fine, but my VPN blocks it.

**To Reproduce**

1. Use either [**OpenVPN**](https://github.com/angristan/openvpn-install) or [**Cloudflare WARP**](https://1.1.1.1/). Connect to the VPN.
2. Run Jamulus.
3. Click Connect.
4. Select **Any Genre 1** from List.

**Expected behavior**
Server list can be seen while on VPN.

**Screenshots**
1. When VPN is off, I cannot see some servers on the list, due to my ISP problem. For example, “SOFTJAM” and “Jamming Mamak” is not shown on this list.

   ![image](https://user-images.githubusercontent.com/193136/129575923-ebafdbb9-80e1-4298-b1cc-ff99c08bb54d.png)

2. When VPN is on, I can connect to the server if I know its IP address (I obtained the IP address and port number through packet capturing with VPN turned off, and then reverse-engineering the reply). However, the server list is blank and I cannot see any server. So it is quite inconvenient.

   ![image](https://user-images.githubusercontent.com/193136/129575981-36ed72cd-1a16-4c17-b6f9-e3b1b1667073.png)

3. A workaround is applied. I can see the servers I want to connect to now.

   ![image](https://user-images.githubusercontent.com/193136/129576114-f0f4499e-514f-4893-b86d-c8d4ac12b404.png)

**Operating system**
macOS 11.5.1, official binaries.

**Version of Jamulus**
3.8.0

**Additional context**
Workaround

- **Cloudflare WARP:** Go to **Preferences** &rarr; **Advanced** &rarr; **Excluded IPs** and add `62.113.206.102/32`.
- **OpenVPN:** Add to the `.ovpn` configuration file: `route 62.113.206.102 255.255.255.255 net_gateway`

**Comment by softins** [comment]
This is a known limitation of the existing Jamulus protocol, which uses UDP to send large messages when returning lists of servers or lists of connected clients. This was raised in #1058 a long time ago, but no good solution has yet been devised.

So in the meantime it is necessary to use Jamulus only over paths that correctly support IP fragmentation and reassembly.

**Comment by DavidSavinkoff** [comment]
Hi @dtinth,
I've got an unrelated question that maybe you or another skillful Mac person can investigate.
I recently added DSCP tagging (quality of service) to Jamulus which works flawlessly for Linux, and probably works on older Macs and Windows. However, Apple and Microsoft have put countermeasures into their operation systems so that DSCP tagging is set to zero.
Windows has a workaround, Mac doesn't. Is there some setting in your menus for fixing this as I only have Linux computers to play with? THX

**Comment by dtinth** [comment]
@softins I see, thanks for confirming.

@DavidSavinkoff Sorry I could not help much with this, as I don’t have much knowledge about networking. I tried searching around on how to set DSCP tagging on macOS but did not find any useful answer.
